{
  "complaint_id": "USCCR-36989",
  "state": "California",
  "federal_agency": "Equal Employment Opportunity Commission",
  "subject": "Electoral Process",
  "basis": "Race",
  "filing_date": "2025-03-15",
  "fiscal_year": 2025,
  "status": "Resolved",
  "resolution": "Administrative Closure",
  "complainant_type": "Organization"
}